{
  "$schema": "https://json-schema.org/draft/2020-12/schema",
  "$id": "https://altertable.ai/schemas/cli-reference/v1.json",
  "title": "Altertable CLI reference",
  "description": "Versioned public documentation contract generated from the Altertable CLI command descriptor.",
  "type": "object",
  "additionalProperties": false,
  "required": [
    "schemaVersion",
    "cliVersion",
    "globalOptions",
    "groups"
  ],
  "properties": {
    "schemaVersion": {
      "const": 1
    },
    "cliVersion": {
      "type": "string"
    },
    "globalOptions": {
      "type": "array",
      "items": {
        "$ref": "#/$defs/argument"
      }
    },
    "groups": {
      "type": "array",
      "items": {
        "$ref": "#/$defs/group"
      }
    }
  },
  "$defs": {
    "argument": {
      "type": "object",
      "additionalProperties": false,
      "required": [
        "name",
        "aliases",
        "type",
        "description",
        "required",
        "repeatable",
        "scope",
        "values"
      ],
      "properties": {
        "name": {
          "type": "string"
        },
        "aliases": {
          "type": "array",
          "items": {
            "type": "string"
          }
        },
        "type": {
          "enum": [
            "boolean",
            "string",
            "enum",
            "positional"
          ]
        },
        "description": {
          "type": "string"
        },
        "required": {
          "type": "boolean"
        },
        "repeatable": {
          "type": "boolean"
        },
        "scope": {
          "enum": [
            "root-only",
            "global",
            "command"
          ]
        },
        "values": {
          "type": "array",
          "items": {
            "type": "string"
          }
        },
        "positionalCompletion": {
          "enum": [
            "finite",
            "file",
            "freeform"
          ]
        },
        "valueHint": {
          "type": "string"
        },
        "default": {}
      }
    },
    "command": {
      "type": "object",
      "additionalProperties": false,
      "required": [
        "id",
        "command",
        "description",
        "usage",
        "aliases",
        "arguments",
        "options",
        "examples",
        "subcommands"
      ],
      "properties": {
        "id": {
          "type": "string"
        },
        "command": {
          "type": "string"
        },
        "description": {
          "type": "string"
        },
        "usage": {
          "type": "array",
          "items": {
            "type": "string"
          }
        },
        "aliases": {
          "type": "array",
          "items": {
            "type": "string"
          }
        },
        "arguments": {
          "type": "array",
          "items": {
            "$ref": "#/$defs/argument"
          }
        },
        "options": {
          "type": "array",
          "items": {
            "$ref": "#/$defs/argument"
          }
        },
        "examples": {
          "type": "array",
          "items": {
            "type": "string"
          }
        },
        "subcommands": {
          "type": "array",
          "items": {
            "$ref": "#/$defs/command"
          }
        }
      }
    },
    "group": {
      "type": "object",
      "additionalProperties": false,
      "required": [
        "id",
        "title",
        "commands"
      ],
      "properties": {
        "id": {
          "enum": [
            "platform",
            "ingest",
            "query"
          ]
        },
        "title": {
          "type": "string"
        },
        "commands": {
          "type": "array",
          "items": {
            "$ref": "#/$defs/command"
          }
        }
      }
    }
  }
}
