{
  "schemaVersion": 1,
  "cliVersion": "1.12.0",
  "globalOptions": [
    {
      "name": "help",
      "aliases": [
        "h"
      ],
      "type": "boolean",
      "description": "Show this help",
      "required": false,
      "repeatable": false,
      "scope": "global",
      "values": []
    },
    {
      "name": "version",
      "aliases": [
        "v"
      ],
      "type": "boolean",
      "description": "Show the Altertable CLI version",
      "required": false,
      "repeatable": false,
      "scope": "root-only",
      "values": []
    },
    {
      "name": "debug",
      "aliases": [
        "d"
      ],
      "type": "boolean",
      "description": "Enable debug output",
      "required": false,
      "repeatable": false,
      "scope": "global",
      "values": []
    },
    {
      "name": "json",
      "aliases": [],
      "type": "boolean",
      "description": "Machine-readable JSON output",
      "required": false,
      "repeatable": false,
      "scope": "global",
      "values": []
    },
    {
      "name": "agent",
      "aliases": [],
      "type": "boolean",
      "description": "Agent-friendly preset: structured JSON output, no pager or terminal styling",
      "required": false,
      "repeatable": false,
      "scope": "global",
      "values": []
    },
    {
      "name": "no-agent",
      "aliases": [],
      "type": "boolean",
      "description": "Disable agent mode, including automatic detection",
      "required": false,
      "repeatable": false,
      "scope": "global",
      "values": []
    },
    {
      "name": "no-color",
      "aliases": [],
      "type": "boolean",
      "description": "Disable terminal colors and styling",
      "required": false,
      "repeatable": false,
      "scope": "global",
      "values": []
    },
    {
      "name": "profile",
      "aliases": [],
      "type": "string",
      "description": "Use a named profile for this command only",
      "required": false,
      "repeatable": false,
      "scope": "global",
      "values": []
    },
    {
      "name": "connect-timeout",
      "aliases": [],
      "type": "string",
      "description": "HTTP connect timeout in seconds (default 5)",
      "required": false,
      "repeatable": false,
      "scope": "global",
      "values": []
    },
    {
      "name": "read-timeout",
      "aliases": [],
      "type": "string",
      "description": "HTTP read timeout in seconds (default 60; 0 = no limit for streams)",
      "required": false,
      "repeatable": false,
      "scope": "global",
      "values": []
    },
    {
      "name": "ignore-ssl-errors",
      "aliases": [],
      "type": "boolean",
      "description": "Skip TLS certificate verification for HTTPS requests (for development only, e.g. self-signed local servers)",
      "required": false,
      "repeatable": false,
      "scope": "global",
      "values": []
    }
  ],
  "groups": [
    {
      "id": "platform",
      "title": "Platform",
      "commands": [
        {
          "id": "altertable-login",
          "command": "altertable login",
          "description": "Sign in with your browser (OAuth) and store the session.",
          "usage": [
            "altertable login [options]"
          ],
          "aliases": [],
          "arguments": [],
          "options": [
            {
              "name": "control-plane-url",
              "aliases": [],
              "type": "string",
              "description": "Control-plane server root to log in against; saved to the profile only on success (the CLI appends /oauth and /rest/v1). Default: https://app.altertable.ai",
              "required": false,
              "repeatable": false,
              "scope": "command",
              "values": []
            },
            {
              "name": "data-plane-url",
              "aliases": [],
              "type": "string",
              "description": "Data-plane base URL saved to the profile only on successful login. Default: https://api.altertable.ai",
              "required": false,
              "repeatable": false,
              "scope": "command",
              "values": []
            },
            {
              "name": "allow-insecure-http",
              "aliases": [],
              "type": "boolean",
              "description": "Allow http:// URLs other than localhost for --control-plane-url (for development only)",
              "required": false,
              "repeatable": false,
              "scope": "command",
              "values": []
            },
            {
              "name": "replace-profile",
              "aliases": [],
              "type": "boolean",
              "description": "Store the login session in the current profile instead of switching profiles",
              "required": false,
              "repeatable": false,
              "scope": "command",
              "values": []
            },
            {
              "name": "org",
              "aliases": [],
              "type": "string",
              "description": "Preselect this organization in the browser authorization page",
              "required": false,
              "repeatable": false,
              "scope": "command",
              "values": [],
              "valueHint": "SLUG"
            },
            {
              "name": "env",
              "aliases": [],
              "type": "string",
              "description": "Preselect this environment in the browser authorization page",
              "required": false,
              "repeatable": false,
              "scope": "command",
              "values": [],
              "valueHint": "SLUG"
            },
            {
              "name": "service-account",
              "aliases": [],
              "type": "string",
              "description": "Create an environment-scoped service account with this label and store its access token instead of your login session",
              "required": false,
              "repeatable": false,
              "scope": "command",
              "values": [],
              "valueHint": "LABEL"
            },
            {
              "name": "scope",
              "aliases": [],
              "type": "string",
              "description": "Request a service account limited to `ro` or `rw` on every catalog, or to specific catalogs, e.g. `analytics:ro,staging:rw` (requires --service-account). The catalog access the server actually grants is reported on success.",
              "required": false,
              "repeatable": false,
              "scope": "command",
              "values": [],
              "valueHint": "MODE|CATALOG:MODE,..."
            }
          ],
          "examples": [
            "altertable login",
            "altertable login --org acme --env staging",
            "altertable login --replace-profile",
            "altertable login --service-account \"CI Bot\" --scope analytics:ro",
            "altertable login --service-account \"CI Bot\" --scope ro"
          ],
          "subcommands": []
        },
        {
          "id": "altertable-logout",
          "command": "altertable logout",
          "description": "Remove stored credentials and settings for all profiles.",
          "usage": [
            "altertable logout [options]"
          ],
          "aliases": [],
          "arguments": [],
          "options": [
            {
              "name": "except-current",
              "aliases": [],
              "type": "boolean",
              "description": "Keep the current profile and remove every other profile",
              "required": false,
              "repeatable": false,
              "scope": "command",
              "values": []
            }
          ],
          "examples": [
            "altertable logout",
            "altertable logout --except-current"
          ],
          "subcommands": []
        },
        {
          "id": "altertable-profile",
          "command": "altertable profile",
          "description": "Manage named profiles and stored credentials.",
          "usage": [
            "altertable profile configure|list|show|status|switch|current|env|delete"
          ],
          "aliases": [],
          "arguments": [],
          "options": [],
          "examples": [
            "altertable profile show",
            "altertable profile configure",
            "altertable profile configure acme_production --api-key atm_xxx --env production",
            "altertable profile configure --scope lakehouse",
            "altertable profile list",
            "altertable profile switch",
            "altertable profile status",
            "eval \"$(altertable profile env acme_staging)\"",
            "altertable --profile acme_staging profile show"
          ],
          "subcommands": [
            {
              "id": "altertable-profile-configure",
              "command": "altertable profile configure",
              "description": "Create or update a profile's credentials and settings",
              "usage": [
                "altertable profile configure [options] [NAME]"
              ],
              "aliases": [],
              "arguments": [
                {
                  "name": "name",
                  "aliases": [],
                  "type": "positional",
                  "description": "Profile name (default: selected or active profile)",
                  "required": false,
                  "repeatable": false,
                  "scope": "command",
                  "values": [],
                  "positionalCompletion": "freeform"
                }
              ],
              "options": [
                {
                  "name": "user",
                  "aliases": [],
                  "type": "string",
                  "description": "Lakehouse username (global)",
                  "required": false,
                  "repeatable": false,
                  "scope": "command",
                  "values": []